{"algorithm":"ed25519","app_content_id":"blake3:193f4b3b94c2b83582eafb55b60fdcbf22e5c1546c6b25e3a683ded08aee58f4","key_id":"test-key","public_key":"03a107bff3ce10be1d70dd18e74bc09967e4d6309ba50d5f1ddc8664125531b8","publisher":"dev.vulcan.fixtures","signature":"10b40113aefaaf3a4105a353c800d4243bc3cf6dfd61c37a764ad26eae160d86b6b4913b5a6c6abb95a648142a584b4c4b68e0babf2240e63abc0b4261606502","version":1}